{
  "schema_version": "successor.authority.v0",
  "authority_state": "destination_authoritative",
  "predecessor_commit": "06bde3c8d8a798e5053eff3594b9478606f9e98a",
  "source": {
    "url": "https://github.com/open-horizon-labs/oh-omp",
    "default_branch": "successor-main",
    "remote_exists": true,
    "writable": false,
    "cut_commit": "f72b95dc763f06765ea83d82251f0f11e834fa06",
    "retirement_commit": "68d634f07e85f90baa0f2c747fd0620f18433452"
  },
  "destination": {
    "url": "https://github.com/open-horizon-labs/successor-agent-kernel",
    "default_branch": "main",
    "remote_exists": true,
    "writable": true,
    "candidate_commit": "f8196dd6b252ca70edf3bc04112ca352b43bafad",
    "authority_commit": "3ca83ee79ac8604650b7132f75b98d31c4611ef6"
  },
  "filter": {
    "tool": "git-filter-repo",
    "package_version": "2.47.0",
    "observed_cli_version": "a40bce548d2c",
    "argv": [
      "git-filter-repo",
      "--source",
      "/tmp/successor-wave4-closure.76lxM7/source",
      "--target",
      "/tmp/successor-wave4-closure.76lxM7/candidate",
      "--force",
      "--path",
      "standalone/successor/",
      "--path",
      "crates/successor-protocol/",
      "--path",
      "crates/successor-context-platform/",
      "--path",
      "crates/successor-kernel/",
      "--path",
      "crates/successor-cli/",
      "--path",
      ".oh/workstreams/successor-agent-kernel/",
      "--path",
      "docs/adr/0003-tiered-memory-locator-map.md",
      "--path",
      "docs/adr/0004-tool-result-assembly-bridge.md",
      "--path",
      "docs/adr/0005-clean-sheet-mech-suit-runtime.md",
      "--path",
      "docs/adr/0007-standalone-successor-repository-and-port-ownership.md",
      "--path",
      "docs/evidence/standalone-kernel/",
      "--path",
      "docs/extraction/successor-agent-kernel/authority-record.template.json",
      "--path",
      "docs/extraction/successor-agent-kernel/authority-record.v0.schema.json",
      "--path",
      "docs/extraction/successor-agent-kernel/filter-paths.txt",
      "--path",
      "docs/extraction/successor-agent-kernel/old-source-tombstone-spec.md",
      "--path",
      "docs/extraction/successor-agent-kernel/wave-3-preparation.md",
      "--path",
      "docs/extraction/successor-agent-kernel/wave-3-rehearsal.md",
      "--path",
      "docs/extraction/successor-agent-kernel/wave-3-rehearsal-evidence.md",
      "--path",
      "docs/extraction/successor-agent-kernel/wave-3-rehearsal-result.json",
      "--path-rename",
      "standalone/successor/:"
    ],
    "argv_sha256": "1b6ed5dffe04db9a96928270663e7ba0a3568d3b0b29ad3a7c5f10bc41caa3a6",
    "commit_map_sha256": "2eb8c03bffbf77889c2ec91a15b8ea5207e9333ce41d6100acc3f81c71d7a17f"
  },
  "verification": {
    "locked_check": "pass",
    "locked_all_target_tests": "pass",
    "locked_resolution_integrity": "pass: Cargo.lock remained clean after all locked commands",
    "package_metadata": "pass: four packages at 0.1.0 with approved author and repository",
    "path_dependency_confinement": "pass",
    "fixture_byte_parity": "pass",
    "tracked_inventory": "pass: 171 expected, 171 actual, 0 missing, 0 extra",
    "history_retention": "pass",
    "source_mapping": "pass: source cut maps to candidate",
    "source_mapping_line": "f72b95dc763f06765ea83d82251f0f11e834fa06 f8196dd6b252ca70edf3bc04112ca352b43bafad",
    "commit_map_artifact_scope": "digest and mapping line verified against ephemeral generation workspace; full commit-map is not present in the published remote",
    "future_filter_exclusion": "pass: Wave 4 publication and authority records are source-retained and excluded from regenerated candidate inputs",
    "private_remote_clone": "pass: fresh clone main equals candidate commit and contains no source-only Wave 4 records",
    "destination_visibility": "pass: PRIVATE",
    "destination_default_branch": "pass: main",
    "publication_force_with_lease": "pass: publication main advanced from 31148f9159859ff0b856390edda83e2230c51611 to candidate f8196dd6b252ca70edf3bc04112ca352b43bafad",
    "activation_force_with_lease": "pass: activation main advanced from candidate f8196dd6b252ca70edf3bc04112ca352b43bafad to A 3ca83ee79ac8604650b7132f75b98d31c4611ef6",
    "evidence_push_lease": "pass: pre-push destination main equals A 3ca83ee79ac8604650b7132f75b98d31c4611ef6; B push requires lease main == A",
    "source_retirement_remote": "pass: source successor-main equals 68d634f07e85f90baa0f2c747fd0620f18433452",
    "destination_activation_remote": "pass: destination main equals 3ca83ee79ac8604650b7132f75b98d31c4611ef6",
    "activation_parent": "pass: A parent equals candidate f8196dd6b252ca70edf3bc04112ca352b43bafad",
    "evidence_suite_first_attempt": "known load-sensitive descendant-pipe test returned typed TerminationFailed instead of typed CaptureFailed; governance-only B changes do not touch runtime",
    "evidence_suite_focused_retry": "pass: exact descendant-pipe test 5/5 serially",
    "evidence_suite_full_retry": "pass: complete destination test suite",
    "authority_policy": "pass: source retired and unauthorized for successor mutations; destination is sole authorized mutation location"
  },
  "rollback": {
    "decision": "not_required",
    "reason": null
  },
  "excluded_local_state": [
    "successor-context-platform.sqlite3",
    "successor-context-platform.sqlite3-wal",
    "successor-context-platform.sqlite3-shm",
    "ignored .oh orchestration run logs"
  ]
}
